## source_type,england_rshe_secondary
## band_count,1
## age_range_hint,"ages 11-16 (DfE RSHE statutory guidance; secondary phase = Years 7-11, KS3 + KS4; outcomes framed as 'by the end of secondary school')"
## detection_confidence,high
## progression_philosophy,"The DfE RSHE statutory guidance sets outcomes as 'by the end of secondary school' terminal statements. Unlike the National Curriculum, which has Key Stage progression, RSHE uses a single secondary-phase endpoint. Single-band output reflects the guidance's own structure. Per DfE statutory RSHE guidance (England), Children and Social Work Act 2017."
## band_detail | End of Secondary,age_range=ages 11-16,grade_year=Years 7-11 (KS3 and KS4),"Secondary pupils develop the knowledge, values and personal qualities needed to navigate relationships, health and wellbeing across the full secondary phase. Outcomes are framed as terminal goals for all secondary pupils; year-group sequencing is a school decision."

competency_cluster,lt_id,lt_name,prerequisites,band,indicator_1,indicator_2,indicator_3,self_reflection_prompt,parent_prompt_1,parent_prompt_2,parent_prompt_3,observation_stability
cluster_03: Respectful Treatment of Self and Others,cluster_03_lt_03,Practising Respectful Treatment and Self-Development,Understanding Equality and Respectful Treatment,End of Secondary,The student consistently demonstrates kindness in interactions with peers and adults across different social contexts,The student actively pursues personal interests and hobbies that contribute to their sense of identity and wellbeing,The student speaks positively about their own abilities and shows confidence in expressing their views and preferences,"Think about a situation this term where you had to make a decision about a relationship or your own wellbeing. What did you consider, and what would you do differently now?",How does your child show kindness and consideration towards family members and friends in everyday situations?,What personal interests or activities does your child pursue that seem to bring them joy and confidence?,How does your child talk about themselves and their abilities when facing new challenges or opportunities?,stable
cluster_04: Addressing Bullying and Relationship Endings,cluster_04_lt_03,Acting as a Responsible Bystander,Recognising and Responding to Bullying,End of Secondary,The student reports witnessed bullying incidents to appropriate staff members within a reasonable timeframe,The student takes action to support peers who are being bullied by seeking adult intervention rather than ignoring the situation,The student demonstrates courage in speaking up about suspected bullying even when it involves popular students or complex social dynamics,"Think about a situation this term where you had to make a decision about a relationship or your own wellbeing. What did you consider, and what would you do differently now?",Has your child mentioned reporting bullying incidents they've witnessed at school or in the community?,Does your child talk about helping friends or classmates who are experiencing difficult social situations?,Have you noticed your child showing concern about fairness and standing up for others even when it might be socially challenging?,stable
cluster_07: Managing Digital Content and Image Sharing,cluster_07_lt_03,Responsible Digital Content Practices,Understanding Digital Content Risks and Laws,End of Secondary,The student declines to share personal photos or information when peers request them for social media or messaging apps,The student deletes inappropriate content received from others without forwarding it to additional contacts,The student pauses to consider potential consequences before posting personal content online,"Think about a situation this term where you had to make a decision about a relationship or your own wellbeing. What did you consider, and what would you do differently now?",Have you noticed your child being thoughtful about what they share online or declining to pass along questionable content?,Does your child talk to you about inappropriate messages or images they might receive from friends?,Have you observed your child taking time to think before posting photos or personal information on social media?,stable
cluster_12: Assessing Trustworthiness and Personal Safety,cluster_12_lt_03,Trusting Safety Instincts,Evaluating Trustworthiness and Safety; Seeking Help and Reporting Concerns,End of Secondary,The student removes themselves from situations when they sense something is wrong without needing to justify their decision to others,The student acts on gut feelings about people or situations by changing their behaviour or seeking support,The student verbalises their discomfort when something feels off and takes protective action,"Think about a situation this term where you had to make a decision about a relationship or your own wellbeing. What did you consider, and what would you do differently now?",Have you noticed your child removing themselves from situations or changing plans when something didn't feel right to them?,Does your child talk to you about times when they felt uncomfortable about a person or situation and what they did about it?,Have you seen your child trust their feelings about safety even when others might have thought they were overreacting?,stable
